{
  "$schema": "resolved-bundle/v1",
  "colors": {
    "color.accent.sky": {
      "group": "accent",
      "id": "color.accent.sky",
      "scale": "sky",
      "source": "figma",
      "value": "#a2d7e9"
    },
    "color.grey.d9": {
      "group": "grey",
      "id": "color.grey.d9",
      "scale": "d9",
      "source": "figma",
      "value": "#d9d9d9"
    },
    "color.neutral.white": {
      "group": "neutral",
      "id": "color.neutral.white",
      "scale": "white",
      "source": "figma",
      "value": "#ffffff"
    },
    "color.primary.1": {
      "group": "primary",
      "id": "color.primary.1",
      "scale": "1",
      "source": "figma",
      "value": "#254b9d"
    },
    "color.primary.2": {
      "group": "primary",
      "id": "color.primary.2",
      "scale": "2",
      "source": "figma",
      "value": "#eb2228"
    },
    "color.primary.3": {
      "group": "primary",
      "id": "color.primary.3",
      "scale": "3",
      "source": "figma",
      "value": "#808285"
    },
    "color.primary.4": {
      "group": "primary",
      "id": "color.primary.4",
      "scale": "4",
      "source": "figma",
      "value": "#ffffff"
    },
    "color.primary.bg": {
      "group": "primary",
      "id": "color.primary.bg",
      "scale": "bg",
      "source": "figma",
      "value": "#f2ede4"
    },
    "color.primary.table-accent-a": {
      "group": "primary",
      "id": "color.primary.table-accent-a",
      "scale": "table-accent-a",
      "source": "figma",
      "value": "#b9d5e6"
    },
    "color.primary.table-accent-b": {
      "group": "primary",
      "id": "color.primary.table-accent-b",
      "scale": "table-accent-b",
      "source": "figma",
      "value": "#a7c9de"
    },
    "color.primary.table-surface": {
      "group": "primary",
      "id": "color.primary.table-surface",
      "scale": "table-surface",
      "source": "figma",
      "value": "#d3e4f0"
    },
    "color.secondary.2": {
      "group": "secondary",
      "id": "color.secondary.2",
      "scale": "2",
      "source": "figma",
      "value": "#a4adb8"
    },
    "color.secondary.3": {
      "group": "secondary",
      "id": "color.secondary.3",
      "scale": "3",
      "source": "figma",
      "value": "#545554"
    },
    "color.secondary.bg": {
      "group": "secondary",
      "id": "color.secondary.bg",
      "scale": "bg",
      "source": "figma",
      "value": "#cee3ff"
    },
    "color.secondary.utility-black-20": {
      "group": "secondary",
      "id": "color.secondary.utility-black-20",
      "scale": "utility-black-20",
      "source": "figma",
      "value": "#000000"
    },
    "color.secondary.utility-white-50": {
      "group": "secondary",
      "id": "color.secondary.utility-white-50",
      "scale": "utility-white-50",
      "source": "figma",
      "value": "#ffffff"
    },
    "color.secondary.white-80": {
      "group": "secondary",
      "id": "color.secondary.white-80",
      "scale": "white-80",
      "source": "figma",
      "value": "#ffffff"
    },
    "color.utility.black": {
      "group": "utility",
      "id": "color.utility.black",
      "scale": "black",
      "source": "figma",
      "value": "#000000"
    },
    "color.utility.gray-100": {
      "group": "utility",
      "id": "color.utility.gray-100",
      "scale": "gray-100",
      "source": "figma",
      "value": "#efefef"
    },
    "color.utility.gray-200": {
      "group": "utility",
      "id": "color.utility.gray-200",
      "scale": "gray-200",
      "source": "figma",
      "value": "#dcdcdc"
    },
    "color.utility.gray-300": {
      "group": "utility",
      "id": "color.utility.gray-300",
      "scale": "gray-300",
      "source": "figma",
      "value": "#bdbdbd"
    },
    "color.utility.gray-50": {
      "group": "utility",
      "id": "color.utility.gray-50",
      "scale": "gray-50",
      "source": "figma",
      "value": "#f6f6f6"
    },
    "color.utility.gray-500": {
      "group": "utility",
      "id": "color.utility.gray-500",
      "scale": "gray-500",
      "source": "figma",
      "value": "#818181"
    },
    "color.utility.gray-800": {
      "group": "utility",
      "id": "color.utility.gray-800",
      "scale": "gray-800",
      "source": "figma",
      "value": "#464646"
    },
    "color.utility.gray-950": {
      "group": "utility",
      "id": "color.utility.gray-950",
      "scale": "gray-950",
      "source": "figma",
      "value": "#292929"
    },
    "color.utility.white": {
      "group": "utility",
      "id": "color.utility.white",
      "scale": "white",
      "source": "figma",
      "value": "#ffffff"
    }
  },
  "components": {},
  "diagnostics": [
    {
      "candidates": [
        "#254b9d",
        "#991f21",
        "#4d3300",
        "#101010"
      ],
      "chosen": "#254b9d",
      "code": "COLLISION_PLURALITY",
      "detail": "kept frequency winner #254b9d",
      "severity": "warn",
      "subject": "color.primary.1"
    },
    {
      "code": "UNRESOLVED_EFFECT",
      "detail": "no effect value in export",
      "severity": "info",
      "subject": "effect.background-blur-1"
    },
    {
      "code": "UNRESOLVED_EFFECT",
      "detail": "no effect value in export",
      "severity": "info",
      "subject": "effect.background-blur"
    },
    {
      "code": "UNRESOLVED_EFFECT",
      "detail": "no effect value in export",
      "severity": "info",
      "subject": "effect.dropshadow-light"
    },
    {
      "code": "UNRESOLVED_EFFECT",
      "detail": "no effect value in export",
      "severity": "info",
      "subject": "effect.shadow-1"
    },
    {
      "code": "UNRESOLVED_EFFECT",
      "detail": "no effect value in export",
      "severity": "info",
      "subject": "effect.shadow-2"
    },
    {
      "code": "UNRESOLVED_EFFECT",
      "detail": "no effect value in export",
      "severity": "info",
      "subject": "effect.shadow-3"
    },
    {
      "code": "UNRESOLVED_EFFECT",
      "detail": "no effect value in export",
      "severity": "info",
      "subject": "effect.shadow-4"
    },
    {
      "code": "UNRESOLVED_EFFECT",
      "detail": "no effect value in export",
      "severity": "info",
      "subject": "effect.shadow-large"
    },
    {
      "code": "UNRESOLVED_GRADIENT",
      "detail": "no stop data; emitter must supply a fallback",
      "severity": "info",
      "subject": "gradient.1"
    },
    {
      "code": "UNRESOLVED_GRADIENT",
      "detail": "no stop data; emitter must supply a fallback",
      "severity": "info",
      "subject": "gradient.2"
    },
    {
      "code": "UNRESOLVED_GRADIENT",
      "detail": "no stop data; emitter must supply a fallback",
      "severity": "info",
      "subject": "gradient.3"
    },
    {
      "code": "UNRESOLVED_GRADIENT",
      "detail": "no stop data; emitter must supply a fallback",
      "severity": "info",
      "subject": "gradient.4"
    },
    {
      "code": "UNRESOLVED_GRADIENT",
      "detail": "no stop data; emitter must supply a fallback",
      "severity": "info",
      "subject": "gradient.bg"
    },
    {
      "code": "UNRESOLVED_GRADIENT",
      "detail": "no stop data; emitter must supply a fallback",
      "severity": "info",
      "subject": "gradient.footer"
    },
    {
      "code": "UNRESOLVED_GRADIENT",
      "detail": "no stop data; emitter must supply a fallback",
      "severity": "info",
      "subject": "gradient.linear.2"
    },
    {
      "code": "UNRESOLVED_GRADIENT",
      "detail": "no stop data; emitter must supply a fallback",
      "severity": "info",
      "subject": "gradient.linear.3"
    },
    {
      "candidates": [
        "18/400/1.4/sans",
        "16/400/1.4/sans",
        "20/400/1.4/sans"
      ],
      "code": "COLLISION_PLURALITY",
      "detail": "kept frequency-winning metrics",
      "severity": "warn",
      "subject": "type.body.body-1"
    },
    {
      "code": "TRAIT_CONFLICT",
      "detail": "conflicting node traits ignored (not token facts)",
      "severity": "info",
      "subject": "type.body.body-1"
    },
    {
      "code": "TRAIT_CONFLICT",
      "detail": "conflicting node traits ignored (not token facts)",
      "severity": "info",
      "subject": "type.body.body-2"
    },
    {
      "candidates": [
        "14/400/1.4/sans",
        "16/400/1.4/sans"
      ],
      "code": "COLLISION_PLURALITY",
      "detail": "kept frequency-winning metrics",
      "severity": "warn",
      "subject": "type.body.body-3"
    },
    {
      "code": "TRAIT_CONFLICT",
      "detail": "conflicting node traits ignored (not token facts)",
      "severity": "info",
      "subject": "type.body.body-3"
    },
    {
      "candidates": [
        "14/400/1.4/sans",
        "18/400/1.4/sans2"
      ],
      "code": "COLLISION_PLURALITY",
      "detail": "kept frequency-winning metrics",
      "severity": "warn",
      "subject": "type.body.body-4"
    },
    {
      "code": "TRAIT_CONFLICT",
      "detail": "conflicting node traits ignored (not token facts)",
      "severity": "info",
      "subject": "type.body.body-4"
    },
    {
      "code": "MISSING_CONTRACT",
      "detail": "no contract entry; defaulted to <div> .body",
      "severity": "info",
      "subject": "type.body.body"
    },
    {
      "code": "MISSING_CONTRACT",
      "detail": "no contract entry; defaulted to <div> .light-1",
      "severity": "info",
      "subject": "type.font-awesome.light-1"
    },
    {
      "candidates": [
        "48/700/1.2/sans",
        "48/700/1.3/sans2"
      ],
      "code": "COLLISION_PLURALITY",
      "detail": "kept frequency-winning metrics",
      "severity": "warn",
      "subject": "type.heading.heading-1"
    },
    {
      "code": "TRAIT_CONFLICT",
      "detail": "conflicting node traits ignored (not token facts)",
      "severity": "info",
      "subject": "type.heading.heading-1"
    },
    {
      "code": "TRAIT_CONFLICT",
      "detail": "conflicting node traits ignored (not token facts)",
      "severity": "info",